### ISSUE TITLE
Attemp read InputStream in connection is closed/reseted case for reasoning

### ISSUE THREAD

**Issue by itugs** [xetorthio/jedis#981]
This is related with #906

When Redis close client connection, it write ERR Resp message to client.
It is worth if we can read it and use as exception message for reasoning.

error case example
```
09:17:27.740553 IP localhost.53053 > localhost.6379: Flags [P.], seq 1:8191, ack 1, win 12759, options [nop,nop,TS val 404996303 ecr 404994609], length 8190
E. 2..@.@............=..0....9mX..1..'.....
.#...#.1*1048578  <---- exceed limitation
$5
HMSET
$14
RedisHmsetTest
$18
100001569758228599
$18

09:17:27.740797 IP localhost.6379 > localhost.53053: Flags [P.], seq 1:48, ack 8191, win 12503, options [nop,nop,TS val 404996303 ecr 404996303], length 47
E..cg.@.@..............=.9mX0.:...0..W.....
.#...#..-ERR Protocol error: invalid multibulk length  <-- protocol error

... omitted ...

09:17:27.740865 IP localhost.6379 > localhost.53053: Flags [R], seq 238644616, win 0, length 0
E..(..@.@..............=.9m.....P.......  <-- RST
```

**Comment by marcosnils** [comment]
Close by #985
